{"schema_version":"1.0","task_num":1,"task_id":"007bbfb7","status":"passed","summary":"Optimized the champion from objective 966 to 488 (49.5% reduction) using a legal six-node opset-9 graph. The exact candidate passed 3148/3148 protected cases and was auto-promoted. It remains above the approximate 94.97 cross-task budget.","candidate_path":"/media/rohit-raje/Elements/Rohit/rohit_lenovo/explore/neurogolf/tasks/task001/solution/candidate.onnx","candidate_sha256":"87627d6d6cdca34a8e9481b1a283db4de5292abb2f272a20f89fd9d80aa56734","gate_result_path":"/media/rohit-raje/Elements/Rohit/rohit_lenovo/explore/neurogolf/tasks/task001/state/gate_result.json","commands":["~/.venv/bin/python tasks/task001/solution/build.py","~/.venv/bin/pytest -q tasks/task001/devtests","~/.venv/bin/python -m neurogolf.cli onnx inspect tasks/task001/solution/candidate.onnx --cost-breakdown","~/.venv/bin/python -m neurogolf.cli gate run --task 1 --candidate /media/rohit-raje/Elements/Rohit/rohit_lenovo/explore/neurogolf/tasks/task001/solution/candidate.onnx --output /media/rohit-raje/Elements/Rohit/rohit_lenovo/explore/neurogolf/tasks/task001/state/gate_result.json","~/.venv/bin/python -m neurogolf.cli champions show 1"],"tests":[{"name":"Development tests","passed":true,"details":"6/6 passed, including semantic boundaries, all colors, conversion parity, and cost regression."},{"name":"Checker and runtime","passed":true,"details":"Full ONNX checker, strict shape inference, disabled-optimization runtime, static I/O contract, and exact output parity passed."},{"name":"Protected gate","passed":true,"details":"Public 6/6; ARC-GEN 262/262; regression 256/256; fuzz 512/512; boundary 64/64; sealed 2048/2048."},{"name":"Official score","passed":true,"details":"476 intermediate bytes + 12 parameter elements = objective 488 and 18.80968459414685 points."},{"name":"Auto-promotion","passed":true,"details":"Exact hash 87627d6d6cdca34a8e9481b1a283db4de5292abb2f272a20f89fd9d80aa56734 is the current champion."},{"name":"Result schema and hash consistency","passed":true,"details":"tasks/task001/state/codex_result.json validates; candidate, gate report, and promoted champion hashes match."}],"next_action":"No required action remains; further golf needs a new semantics-preserving representation to approach objective 94.97."}